ReviewText,Rating,MovieTitle,Genre,ReviewDate,Language
"La película fue increíble, con actuaciones destacadas y un guion emocionante.",9,"El Gran Escape","Acción","2023-01-15","es"
"La trama fue predecible y los personajes poco desarrollados.",3,"Historias Urbanas","Drama","2023-02-20","es"
"Una experiencia cinematográfica única, visualmente impresionante.",8,"Aventura Sin Límites","Aventura","2023-03-10","es"
"El ritmo de la película fue lento, aunque la actuación fue buena.",5,"Cuentos Inolvidables","Comedia","2023-04-05","es"
"Una obra maestra con efectos especiales sorprendentes y una narrativa cautivadora.",10,"Futuro Incierto","Ciencia Ficción","2023-05-01","es"
"Las escenas de acción estuvieron bien ejecutadas, pero la historia no convence.",6,"Acción al Límite","Acción","2023-06-12","es"
"El desarrollo de personajes fue superficial, haciendo que la película pierda profundidad.",4,"Historias Olvidadas","Drama","2023-07-20","es"
"La música y el ambiente complementaron perfectamente la narrativa.",7,"Ritmo Perfecto","Musical","2023-08-08","es"
"Un film que mezcla bien comedia y drama, con un final inesperado.",8,"Risas y Lágrimas","Comedia","2023-09-15","es"
"La película resulta aburrida y sin ritmo, no logra enganchar.",2,"Sueños Perdidos","Drama","2023-10-03","es"
"Excelente animación y efectos visuales, aunque la trama es simple.",7,"Mundo Animado","Animación","2023-11-10","es"
"Un viaje emocionante que te mantiene al borde del asiento.",9,"Aventura Extrema","Aventura","2023-12-25","es"
"El guion es deficiente y las actuaciones son mediocres.",3,"Cine Rápido","Acción","2024-01-10","es"
"Una película conmovedora que explora profundamente la naturaleza humana.",8,"Sentimientos a Flor de Piel","Drama","2024-02-14","es"
"Falta coherencia en la historia, lo que afecta el impacto emocional.",4,"Fragmentos de Vida","Drama","2024-03-01","es"
"El elenco brilla en cada escena, convirtiendo una historia sencilla en algo especial.",9,"Estrellas en la Oscuridad","Drama","2024-04-20","es"
"La dirección y fotografía son destacables, pero el guion se queda corto.",6,"Luces y Sombras","Suspenso","2024-05-05","es"
"Una mezcla de géneros que logra sorprender en cada giro inesperado.",8,"Mezcla Explosiva","Acción","2024-06-18","es"
"Las actuaciones son notables, pero la trama resulta predecible.",5,"Días de Lluvia","Drama","2024-07-30","es"
"Una obra entretenida que logra capturar la esencia del género.",7,"Ritmo en Movimiento","Comedia","2024-08-12","es"
